{
  "case_id": "case_chemicals",
  "question": "Signals in precursors?",
  "scope": {
    "time_window_days": 180,
    "domains": [
      "chemicals_precursors"
    ]
  },
  "investigations": [
    "cat_00001"
  ],
  "packs": {
    "index": "packs/INDEX.json"
  },
  "profiles": {
    "default": "packs"
  }
}